{
  "format": "portal.app/v2",
  "id": "notes-sample",
  "version": "1.0.0-beta.1",
  "publisher": "example-publisher",
  "compatibility": {
    "platform_api": ">=2.0.0 <3.0.0",
    "runner_protocol": ">=1.0.0 <2.0.0"
  },
  "presentation": {
    "name_key": "app.name",
    "description_key": "app.description",
    "entry": "index.html",
    "locales": [
      "en-US",
      "zh-CN",
      "zh-TW"
    ],
    "routes": [
      {
        "id": "home",
        "path": "/",
        "layout": "document"
      }
    ]
  },
  "frontend": {
    "artifact": "ui.zip",
    "sha256": "aaaaaaaaaaaaaaaaaaaaaaaaaaaaaaaaaaaaaaaaaaaaaaaaaaaaaaaaaaaaaaaa"
  },
  "capabilities": {
    "required": [
      "storage.files"
    ],
    "optional": [
      "notifications.publish"
    ]
  },
  "data": {
    "schema": 1,
    "readable_schemas": [
      1
    ],
    "writes_on_startup": false
  }
}
